Sci Name,Name, Plant Type,Color,Hardiness Zones,Blooms in,Height,Soil needs,Sun needs,Water needs,Maintenance
Tagetes|Marigold|"Annuals, Perennials, Shrubs"|"Tagetes comes in shades of yellow, orange and even white."|":2:3:4:5:6:7:8:9:10:11:"|"Spring, Autumn, Summer"|"These species range in size from 15 to 80 cm (6 inches to 3 ft) tall, rarely until 2 metres (7 ft)."|"Tagetes grows in almost any soil, but will perform best in moderately fertile, well-drained soil."|"Full sun"|"average"|"low"
Tanacetum|Tanacetum|"Annuals, Perennials, Shrubs"|"The flowers are usually white or yellow, depending on species."|":3:4:5:6:7:8:9:"|"Summer"|"These plants can grow from a few inches to 150 cm (5 ft) tall."|"Tanacetum prefers moist and well-drained soil, but tolerates a wide variety of soils and pH conditions."|"Full sun, Partial sun"|"average"|"medium"
Taraxacum|Dandelion|"Perennials"|"The flowers are usually bright yellow, but they can be darker or even white, such as Taraxacum albidum."|":3:4:5:6:7:8:9:10:"|"Spring, Autumn, Winter, Summer"|"Dandelions range in height from 5 to 50 cm (2-20 inches) in height."|"Although Dandelions adopt most conditions and grow everywhere, they will grow best in moist areas with fertile and well-drained soil."|"Full sun, Partial sun"|"average"|"low"
Tigridia|Tiger Flower; Mexican Shellflower|"Bulbs"|"The flowers may be red, yellow, white, cream, orange, scarlet, pink and mauve."|":8:9:10:11:"|"Summer"|"These plants usually grow between 30 and 60 cm (1-2 ft) tall."|"Tigridia performs best in rich and well-drained soil. It is not too fussy when it comes to soil pH."|"Full sun, Partial sun"|"average"|"low"
Torenia|Wishbone Flower; Bluewings; Clown Flower|"Annuals"|"The flowers come in shades of purple, blue, pink, yellow and white."|":2:3:4:5:6:7:8:9:10:11:"|"Spring, Autumn, Summer"|"Torenia grows up to 30 cm (1 ft) in height."|"Torenia prefers rich, loamy, moist and well drained soil. The plant is not particular about soil pH, but it does best in a soil that is slightly acidic."|"Partial sun, Shade"|"average"|"medium"
Tradescantia|Spiderwort|"Perennials"|"The flowers come in shades of blue, purple, pink, red and white."|":4:5:6:7:8:9:10:11:12:"|"Spring, Autumn, Summer"|"This plant can reach up to 90 cm in height."|"Spiderwort prefers fertile, moist and well-drained soil. The soil should be acidic, with a pH range between 5.0 and 6.5."|"Full sun, Partial sun, Shade"|"average"|"low"
Tricyrtis|Toad Lily|"Perennials"|"The flowers come in shades of red, purple, white and yellow."|":4:5:6:7:8:9:"|"Autumn, Summer"|"Tricyrtis reaches up to 90 cm (3 ft) in height."|"Tricyrtis prefers rich, moist and well-drained soil, with a pH from acid to neutral. The plant is adaptable and can tolerate heat, cold and humidity."|"Partial sun, Shade"|"average"|"low"
Trillium|Wake Robin; Birthroot|"Perennials"|"Flower color varies from red, pink, maroon and purple to yellow and white."|":3:4:5:6:7:8:9:"|"Spring, Summer"|"Trillium usually grows between 30 and 60 cm (1-2 ft) in height."|"Trillium performs best in rich, moist and well-drained soil that is neutral to slightly acidic."|"Partial sun, Shade"|"average"|"low"
Trollius|Globe Flower|"Perennials"|"These beautiful flowers bloom in shades of yellow, orange and white."|":3:4:5:6:7:8:"|"Spring, Summer"|"Trollius can grow up to 90 cm (3 ft) in height."|"Trollius prefers rich, poorly-drained soil and regular moisture. The ideal soil pH is between 5.0. and 7.0."|"Full sun, Partial sun"|"average"|"low"
Tropaeolum|Nasturtium|"Annuals, Perennials"|"Nasturtium comes in red, orange, yellow, purple and cream colors."|":2:3:4:5:6:7:8:9:10:11:"|"Spring, Autumn, Summer"|"Nasturtium vary in height from 20 cm (8 inches) to 3 metres (10 ft), depending on species."|"The plant is suitable for sandy and loamy soils with a pH between 5.5 and 7.5. It also grows in nutritionally poor soil."|"Full sun"|"average"|"low"
Ulex|Gorse; Furze|"Shrubs"|"The flowers are usually yellow in color."|":6:7:8:9:10:"|"Spring, Autumn, Winter, Summer"|"The plant can grow up to 3 metres (10 ft) high."|"The plant grows in most soils, but does best in soil that is sandy and slightly acidic. It appreciates hot sun and dry, poor soil."|"Full sun"|"low"|"low"
Ursinia|African Daisy|"Annuals, Perennials"|"Ursinia has yellow, red or orange flowers."|":3:4:5:6:7:8:9:10:11:"|"Spring, Autumn, Winter, Summer"|"Ursinia grows from 20 cm to 60 cm (8 inches to 2 ft) in height."|"Ursinia prefers sandy, fertile and well drained soil."|"Full sun, Partial sun"|"average"|"low"
Valeriana|Valerian|"Perennials"|"The flowers are white, pink or lavender."|":4:5:6:7:8:9:"|"Autumn, Summer"|"The plant can reach 1,5 meters (5 ft) in height."|"The plant performs best in fertile, moist and well drained soil, with slightly acidic to neutral pH."|"Full sun, Partial sun"|"average"|"low"
Verbascum|Mullein|"Annuals, Perennials"|"These flowers are primarily bright yellow, but also white, red, purple and pink."|":5:6:7:8:9:10:"|"Spring, Summer"|"Mullein has a flower spike that reaches 3 metres (10 ft) high."|"Mullein thrives in well-drained soil that is slightly alkaline."|"Full sun"|"low"|"low"
Verbena|Vervain|"Annuals, Perennials"|"The blooms come in shades of purple, red, pink and white."|":3:4:5:6:7:8:9:10:11:12:"|"Autumn, Summer"|"Verbena grows from 7 cm to 180 cm (3 inches to 6 ft) tall, depending on species."|"This plant prefers moist, but well drained soil. It is not particular about soil pH, but it grows best in soil with a pH between 6.0 and 8.0."|"Full sun, Partial sun"|"average"|"low"
Veronica|Speedwell|"Perennials"|"Veronica comes in shades of blue, purple, pink and white."|":3:4:5:6:7:8:9:10:11:"|"Spring, Autumn, Summer"|"Veronica comes in a wide range of sizes, from dwarfs that rarely exceed 10 cm (4 inches) to large specimens that can grow more than 1,5 metres (5 ft) in height."|"This plant prefers moist, but well-drained soil that is neutral, alkaline or acidic."|"Full sun, Partial sun"|"average"|"low"
Veronicastrum|Veronicastrum|"Perennials"|"The flowers come in shades of white, purple and pink."|":3:4:5:6:7:8:9:"|"Autumn, Summer"|"Veronicastrum reaches nearly 2 m (6 ft) in height."|"Veronicastrum prefers fertile, moist and well-drained soil. It tolerates a wide range of soil pH levels."|"Full sun, Partial sun"|"average"|"low"
Vinca|Periwinkle|"Perennials, Shrubs"|"Vinca comes in shades of pink, purple, red and white."|":3:4:5:6:7:8:9:10:11:"|"Autumn, Summer"|"These plants range in size from dwarf species that grow only about 10 cm (4 inches) tall to larger types which can grow up to 60 cm (2 ft) in height."|"Periwinkle prefers moist, but well drained soil and is adaptable to soils of various pHs."|"Full sun, Partial sun, Shade"|"average"|"low"
Viola|Violet|"Annuals, Perennials, Shrubs"|"As their name suggests, many species are violet in color, but can also be blue, white, yellow and cream. Some blooms have two or even three colors."|":3:4:5:6:7:8:9:"|"Spring, Autumn, Winter, Summer"|"Violas are small plants up to 20 cm (8 inches) tall."|"They prefer rich, moist and well drained soil. The ideal pH range is between 5.0 and 6.0."|"Full sun, Partial sun"|"average"|"low"
Watsonia|Bugle Lily|"Bulbs, Perennials"|"The flowers come in shades of red, pink, orange, purple and white."|":8:9:10:11:"|"Spring, Autumn, Winter, Summer"|"This plant grows from 30 cm to 2 metres (1 ft to 7 ft) in height."|"Soil should be acidic or neutral and should be moist and well-drained."|"Full sun"|"average"|"low"
Weigela|Weigela|"Shrubs"|"The flowers come in shades of red, pink, white and yellow."|":4:5:6:7:8:9:"|"Spring, Autumn, Summer"|"This plant grows from 30 cm (1 ft) to 3 metres (10 ft) high."|"Weigela prefers fertile and moist, but well-drained soil. It can tolerate soil pH levels between 5.5 and 7.5."|"Full sun, Partial sun"|"average"|"low"
Wisteria|Wisteria|"Climbers"|"Wisteria comes in shades of white, blue, purple and pink."|":5:6:7:8:9:"|"Spring, Summer"|"Wisteria grows from 180 cm to 12 metres (6 to 40 ft) tall, depending on species."|"Wisteria likes moist, well-drained and fertile soil. It grows best in slightly acidic to neutral soil."|"Full sun, Partial sun"|"average"|"hard"
Xanthisma|Xanthisma|"Annuals, Perennials"|"The flowers are generally yellow in color, but there are also varieties that are white and purple."|":3:4:5:6:7:8:9:"|"Spring, Autumn, Winter, Summer"|"This plant can reach a height of 60 cm (2 ft)."|"Xanthisma prefers well-drained, sandy soil and can survive in dry soil as well. It tolerates pH levels between 5.0 and 7.0."|"Full sun, Partial sun"|"low"|"low"
Xeranthemum|Xeranthemum|"Annuals"|"These flowers come in shades of pink, purple and white."|":2:3:4:5:6:7:8:9:10:"|"Autumn, Summer"|"This plant can grow between 30 and 90 cm (1-3 ft) tall."|"Xeranthemum prefers fertile, moist and well-drained soil."|"Full sun"|"average"|"low"
Xerochrysum|Xerochrysum|"Annuals, Perennials, Shrubs"|"Its bracts are yellow, orange, purple, pink and red."|":8:9:10:11:"|"Spring, Autumn, Summer"|"Xerochrysum grows from 20 to 150 cm (8 inches to 5 ft) tall, depending on species."|"Xerochrysum prefers soil with a pH of 5.5 to 7.5,, but the plant grows in nearly any well-drained soil."|"Full sun"|"average"|"low"
Xerophyllum|Xerophyllum|"Herbs, Perennials"|"Xerophyllum has unique cream-colored flowers."|":4:5:6:7:8:"|"Spring, Summer"|"These plants can grow from 50 cm to 1,5 meters (2-5 ft) tall, with numerous small flowers growing on long flower stalks."|"Xerophyllum prefers sandy or loamy soil that is well-drained."|"Full sun, Partial sun"|"low"|"low"
Yucca|Yucca|"Cactus - Succulents, Shrubs, Trees"|"The Yucca plant has green, sword-like leaves and white or whitish flowers."|":4:5:6:7:8:9:10:11:"|"Spring, Autumn, Summer"|"Yucca grows from 60 cm to 4,5 metres (2 to 15 ft) high, depending on species."|"This plant grows best in sandy and well drained soil, with a pH level between 5.5 and 7.5."|"Full sun, Partial sun"|"low"|"low"
Zantedeschia|Calla Lily; Arum Lily|"Bulbs, Perennials"|"Calla Lily is available in a multitude of colors including white, yellow, orange, pink, purple and even black."|":3:4:5:6:7:8:9:10:"|"Spring, Summer"|"The plant grows between 30 and 90 cm (1 to 3 ft) tall."|"This plant grows best in moist and well-drained soil. The ideal soil pH level is between 6.0 and 6.5."|"Full sun, Partial sun"|"average"|"low"
Zephyranthes|Rain Lily; Fairy Lily|"Annuals, Bulbs, Perennials"|"The flowers may be yellow, pink and white."|":7:8:9:10:11:"|"Spring, Autumn, Summer"|"The plant can grow up to 30 cm (1 ft) in height."|"Zephyranthes prefers well-drained soil with a good application of organic material."|"Full sun, Partial sun"|"average"|"medium"
Zinnia|Zinnia|"Annuals, Perennials, Shrubs"|"These flowers are known for their vivid colors. They are often multi-colored and may be yellow, orange, white, red, pink and purple."|":2:3:4:5:6:7:8:9:10:11:"|"Autumn, Summer"|"Zinnias range in size from dwarf species that only grow 17 cm (7 inches) high to vigorous types over 120 cm (4 ft) tall."|"Zinnias prefer fertile and moist, but well-drained soil, with a pH level between 5.5 and 7.5."|"Full sun"|"average"|"low"
Zygopetalum|Zygo|"Perennials"|"Zygopetalum has unusually colored flowers in shades of blue, purple, red and white."|":9:10:11:"|"Spring, Autumn, Winter"|"Zygopetalum usually grows to a height of 40 cm (16 inches)."|"These plants prefer moist and well-drained soil, with a pH level between 5.5 and 6.5."|"Full sun, Partial sun"|"average"|"medium"
