Sci Name,Name, Plant Type,Color,Hardiness Zones,Blooms in,Height,Soil needs,Sun needs,Water needs,Maintenance
Lewisia|Lewisia|"Perennials"|"The flowers come in shades of white, pink, purple, orange and red."|":3:4:5:6:7:8:"|"Spring, Autumn, Summer"|"Lewisia is a small plant, growing up to 30 cm (1 ft) in height."|"Lewisia prefers moderately fertile and well drained soil, with a ph value between 5.0 and 8.0. It is drought tolerant and thrives in poor and dry soils."|"Full sun, Partial sun"|"low"|"low"
Liatris|Blazing Star; Gayfeather|"Perennials"|"The flowers come in shades of purple, lavender, pink, white, rose and violet."|":3:4:5:6:7:8:9:10:"|"Autumn, Summer"|"The plant grows up to 150 cm (5 ft) in height."|"Liatris will grow best in sandy or loamy soil, with a pH between 5.5 and 7.5. Plant Liatris in tough soil conditions with good drainage."|"Full sun"|"average"|"low"
Lilium|Lily|"Bulbs, Perennials"|"Lilies come in a large variety of colors and the most common are white, yellow, orange and red."|":3:4:5:6:7:8:9:"|"Spring, Autumn, Summer"|"Some species are small, about 30 cm or 1 ft (such as Dwarf Asiatic Lilies), while others can reach a height of 270 cm or 9 ft (Lilium Superbum)."|"Most Lilies prefer moist and well-drained soil and they will perform best in soil that is slightly acidic."|"Full sun, Partial sun"|"average"|"low"
Limonium|Sea Lavender; Statice|"Annuals, Perennials, Shrubs"|"The flowers are blue, purple, pink, yellow or white."|":3:4:5:6:7:8:9:10:11:"|"Spring, Summer"|"The plant grows up to 90 cm (3 ft) in height."|"Limonium prefers rich and well-drained soil in full sun. It is not particular as to soil pH."|"Full sun"|"low"|"low"
Lobelia|Lobelia|"Annuals, Perennials, Shrubs"|"The flowers come in shades of blue, white, pink, red and purple."|":3:4:5:6:7:8:9:"|"Spring, Autumn, Summer"|"The plant ranges in height from 15 cm (6 inches) to 150 cm (5 ft), depending on species."|"Lobelia prefers rich, moist and well drained soil, with a pH level from 6.0 to 7.5."|"Full sun, Partial sun"|"average"|"low"
Lonicera|Honeysuckle|"Climbers, Shrubs"|"The flowers come in shades of white, yellow, pink, orange and red."|":2:3:4:5:6:7:8:9:10:"|"Spring, Autumn, Winter, Summer"|"Honeysuckles range in height from 60 cm (2 ft) to 9 m (30 ft) tall."|"Some species prefer fertile, rich, moist and well-drained soil, while others will grow in any well-drained soil."|"Full sun, Partial sun"|"average"|"low"
Lupinus|Lupine; Lupin|"Annuals, Perennials"|"The flowers are usually blue or purple, but sometimes pink, yellow and white."|":4:5:6:7:8:"|"Spring, Summer"|"Lupinus grows from 30 cm to 1,5 m (1 to 5 ft) tall, depending on species."|"Lupinus grows best in well drained, neutral to slightly acidic soil. The ideal pH is between 5.5 and 7.0."|"Full sun, Partial sun"|"average"|"low"
Lycoris|Red Spider Lily|"Bulbs, Perennials"|"The flowers come in shades of red, pink, orange, white and yellow."|":5:6:7:8:9:10:"|"Spring, Autumn, Summer"|"Lycoris grows up to 60 cm (2 ft) in height."|"The plant prefers soils that are rich and well-drained, with medium moisture. It is not fussy about the soil pH."|"Full sun, Partial sun"|"average"|"low"
Magnolia|Magnolia|"Shrubs, Trees"|"Magnolia produces white, purple, pink and yellow flowers, depending on variety."|":4:5:6:7:8:9:"|"Spring, Summer"|"The trees can grow to a height of 20 metres (65 ft), while shrubs are smaller and are 2,5 to 6 metres (8-20 ft) high."|"Magnolia grows best in rich, moist and well drained soil. They prefer acidic soil, but can tolerate clay, loam, or sand."|"Full sun, Partial sun"|"average"|"low"
Malva|Mallow|"Annuals, Perennials"|"The flowers are usually pink, purple and white."|":3:4:5:6:7:8:9:10:"|"Spring, Autumn, Summer"|"This plant grows up to 150 cm (5 ft) in height, but most of the species are smaller than that."|"Mallow likes rich and well-drained soil, even slightly dry and poor. Most species prefer neutral to slightly acidic pH."|"Full sun, Partial sun"|"average"|"low"
Mandevilla|Dipladenia; Rocktrumpet|"Annuals, Climbers, Perennials"|"The flowers come in shades of red, pink, white and yellow."|":9:10:11:"|"Spring, Autumn, Summer"|"The species can grow up to 6 metres (20 ft) in height, or even more."|"Mandevilla prefers rich, sandy and well drained soil with organic material added."|"Partial sun"|"average"|"medium"
Mimosa|Mimosa|"Annuals, Perennials, Shrubs, Trees"|"The flowers come in shades of pink, purple and white."|":9:10:11:12:13:"|"Summer"|"They can be found in various sizes and some (Mimosa pigra) may grow as large as 6 m (20 ft) tall."|"Mimosa grows best in moist and well-drained loamy soil. The ideal soil pH is between 5.0 and 7.0."|"Full sun, Partial sun"|"average"|"medium"
Monarda|Bee Balm; Bergamot|"Perennials"|"These flowers come in shades of red, pink, purple and white."|":3:4:5:6:7:8:9:"|"Autumn, Summer"|"Different varieties vary in height from dwarf species barely 25 cm (10 inches) tall to &#34;giants&#34; that reach about 1,5 metres (5 ft) high."|"Monarda prefers well drained soil, with a pH from 6.0 to 7.0."|"Full sun, Partial sun"|"average"|"low"
Muscari|Grape Hyacinth|"Bulbs"|"These flowers are commonly blue. However, the white, pink and yellow types can also be found."|":4:5:6:7:8:9:"|"Spring"|"Muscari is a small plant that grows between 10 cm (4 inches) and 25 cm (10 inches) tall."|"The plant grows best in moist and well drained soil, with a pH between 6.0 and 7.0."|"Full sun, Partial sun"|"average"|"low"
Myosotis|Forget Me Not; Scorpion Grass|"Perennials"|"The flowers are usually blue, but may be pink or white, sometimes with a yellow center."|":3:4:5:6:7:8:9:"|"Spring, Summer"|"Myosotis can reach about 30 cm (1 ft) in height."|"This plant performs best in rich, moist and well drained soil, with a pH between 5.5 and 7.5."|"Full sun, Partial sun"|"average"|"low"
Myrtus|Myrtle|"Shrubs, Trees"|"The flowers are most commonly white."|":8:9:"|"Spring, Summer"|"Myrtle grows up to 6 metres (20 ft) in height."|"Myrtle likes moist and well drained soil. The ideal pH value is between 6.0 and 8.0."|"Full sun, Partial sun"|"average"|"low"
Narcissus|Daffodil|"Bulbs, Perennials"|"These flowers are usually white and yellow."|":3:4:5:6:7:8:9:"|"Spring"|"Some species can reach a height of 10 cm (4 inches), while others can grow up to 90 cm (3 ft) tall."|"These plants prefer rich and moist, but well-drained soil and will grow best in soil that is neutral to slightly acidic (pH of 6.0 to 7.0)."|"Full sun, Partial sun"|"low"|"low"
Nelumbo|Lotus|"Perennials"|"Nelumbo nucifera has white or pink flowers, while Nelumbo lutea has yellow ones."|":4:5:6:7:8:9:10:"|"Spring, Summer"|"The leaves and flowers of Nelumbo nucifera are held on stems up to 2 metres (7 ft) tall. The Nelumbo lutea are almost the same size, ranging from 80 cm to 1,5 metres (3-5 ft) in height."|"Both species need rich and loamy soil. The optimal soil pH is between 6.5 and 8.0."|"Full sun"|"average"|"low"
Nemesia|Nemesia|"Annuals, Perennials, Shrubs"|"These flowers come in shades of blue, purple, red, pink, orange, mauve, yellow, cream and white."|":8:9:10:11:"|"Spring, Autumn, Winter, Summer"|"The half-inch flowers bloom on plants that grow up to 60 cm (2 ft) tall."|"Nemesia likes moist and well drained soil. The ideal soil pH is between 5.5 and 7.0."|"Full sun, Partial sun"|"average"|"low"
Nemophila|Baby Blue Eyes|"Annuals"|"The flowers vary in color from a true blue to a definite purple."|":2:3:4:5:6:7:8:9:10:11:"|"Spring, Winter"|"Nemophila is a small plant, rarely growing over 30 cm (1 ft) high."|"The plant likes rich, moist and well drained soil. It prefers soil with a pH of 5.5 to 8.0."|"Full sun, Partial sun"|"average"|"low"
Nepeta|Catmint; Catnip; Cataria|"Perennials"|"Nepeta comes in shades of blue, purple, white and even pink and yellow."|":3:4:5:6:7:8:9:"|"Spring, Autumn, Summer"|"Nepeta grows between 20 cm and 2 metres (8 inches to 7 ft) high, depending on variety."|"Nepeta prefers moist and well drained soil, with a pH level between 5.5 and 7.0."|"Full sun, Partial sun"|"low"|"low"
Nerine|Guernsey Lily|"Bulbs, Perennials"|"The flowers come in shades of pink, orange, red and white."|":8:9:10:11:"|"Autumn, Summer"|"Nerine reaches 60 cm (2 ft) in height."|"Nerine likes moist and well drained soil. It is not particular as to soil type or pH."|"Full sun, Partial sun"|"average"|"medium"
Nerium|Oleander|"Shrubs, Trees"|"The flowers come in shades of red, purple, pink, yellow, cream and white."|":8:9:10:11:"|"Spring, Autumn, Summer"|"This plant can grow up to 6 meters (20 ft) high."|"Oleander will grow in almost any soil and can tolerate drought and high salt content in soil. The ideal soil pH is between 6.5 and 7.5."|"Full sun"|"average"|"low"
Nigella|Love-in-a-mist; Devil-in-a-bush|"Annuals"|"The flowers are blue, white and even yellow and pink."|":2:3:4:5:6:7:8:9:10:"|"Spring, Autumn, Summer"|"Nigella grows between 20 cm (8 inches) and 90 cm (3 ft) in height."|"The plant prefers good drainage and average soil with a pH value between 6.0 to 7.0."|"Full sun, Partial sun"|"average"|"low"
Obregonia|Artichoke Cactus|"Cactus - Succulents"|"The flower colors are usually white or slightly pink, with yellow stamens."|":9:10:11:12:"|"Summer"|"Obregonia is a small-sized plant, about 15 cm (6 inches) in height."|"Obregonia performs best in well-drained soil with little organic material and neutral pH."|"Full sun, Partial sun"|"low"|"medium"
Oenothera|Oenothera|"Annuals, Perennials"|"Oenothera produces yellow, pink and white flowers."|":3:4:5:6:7:"|"Spring, Autumn, Summer"|"The species vary in size from 15 cm to 2,5 metres (6 inches to 8 ft) high."|"Oenothera prefers well-drained soil and will do well in poor soil."|"Full sun, Partial sun"|"average"|"low"
Opuntia|Prickly Pear|"Cactus - Succulents"|"These flowers are usually yellow, sometimes red and pink, but rarely white."|":6:7:8:9:10:11:"|"Spring, Summer"|"Opuntias vary in height from 20 cm (8 inches) to giants that grow up to 4,5 metres (15 ft) in height."|"Opuntia needs well-drained soil that is acid, alkaline or neutral."|"Full sun, Partial sun"|"low"|"low"
Ornithogalum|Star of Bethlehem|"Bulbs, Perennials"|"The flowers come in white, yellow and orange colors."|":4:5:6:7:8:9:10:"|"Spring, Summer"|"The plant can grow between 10 and 60 cm (4 inches to 2 ft) tall."|"Ornithogalum prefers moist, but well-drained soil. You can grow it in any sandy or loamy soil."|"Full sun, Partial sun"|"average"|"low"
Osteospermum|African Daisy|"Annuals, Perennials, Shrubs"|"The flowers come in numerous colors and shades including blue, purple, mauve, pink, yellow, white and cream."|":9:10:11:"|"Spring, Autumn, Summer"|"Osteospermum reaches up to 60 cm (2 ft) in height."|"These sun-loving plants prefer well-drained soil of average fertility. They do not appear to be fussy about soil pH."|"Full sun"|"average"|"low"
Oxalis|Wood Sorrel|"Annuals, Bulbs, Perennials"|"The flowers come in shades of yellow, pink, white and purple."|":4:5:6:7:8:9:10:11:"|"Spring, Autumn, Summer"|"This plant reaches 7 to 30 cm (3 to 12 inches) in height."|"Oxalis prefers moist and well drained soil, but does not like to be in a soggy spot. They have no special soil requirements."|"Full sun, Partial sun"|"average"|"low"
Paeonia|Peony|"Perennials, Shrubs"|"Peonies produce red, pink, purple, white and yellow flowers."|":2:3:4:5:6:7:8:9:"|"Spring, Summer"|"These species range in size from 60 cm to 120 cm (2 to 4 ft) tall. However, Peony trees can grow to 3 metres (10 ft) in height."|"Peony likes moist and well drained soil, with a pH level from 6.0 to 7.5."|"Full sun, Partial sun"|"average"|"low"
Papaver|Poppy|"Annuals, Perennials"|"The flowers bloom in a range of colors, from white, yellow, pink and orange to red and purple."|":3:4:5:6:7:8:9:10:"|"Spring, Summer"|"Poppy usually grows between 30 and 90 cm (1-3 ft) tall."|"The plant likes well drained soil that is acidic, neutral or alkaline. It tolerates poor soil and drought."|"Full sun, Partial sun"|"average"|"low"
Passiflora|Passion Flower; Passion Vine|"Annuals, Climbers, Perennials, Shrubs, Trees"|"Though a wide range of colors exist, the most common are white, purple and blue."|":6:7:8:9:10:11:"|"Spring, Autumn, Summer"|"These plants range in size from 60 cm (2 ft) to 20 metres (65 ft), depending on variety."|"Passiflora likes soil that is fertile, moist and well drained. Soil pH can be anywhere between 6.0 to 7.5."|"Full sun, Partial sun"|"average"|"medium"
Pelargonium|Geranium|"Annuals, Cactus - Succulents, Perennials, Shrubs"|"The flowers come in shades of red, purple, orange, pink and white, with many bicolored combinations."|":8:9:10:11:12:"|"Spring, Autumn, Summer"|"Pelargoniums grow from 30 to 180 cm (1 to 6 ft) tall."|"Pelargoniums prefer fertile, moist and well-drained soil. They are not particular about soil pH, but will do best in a soil that is neutral to slightly acidic."|"Full sun, Partial sun"|"average"|"low"
Penstemon|Beardtongue|"Perennials"|"Penstemon flowers come in shades of white, yellow, blue, red and purple."|":3:4:5:6:7:8:9:10:"|"Autumn, Summer"|"This plant grows between 30 cm (1 ft) and 120 cm (4 ft) high, depending on species."|"Most Penstemons require moist and well-drained soil. They usually grow on poor, rocky or sandy soils. This plant does not seem to be fussy about the soil pH, but prefers soil with a pH from 5.5 to 7.0."|"Full sun, Partial sun"|"average"|"low"
Perovskia|Perovskia|"Perennials, Shrubs"|"The flowers come in shades of purple and blue."|":4:5:6:7:8:9:"|"Autumn, Summer"|"Perovskia grows up to 150 cm (5 ft) tall."|"This plant does not need a rich soil to grow well, but good drainage is needed. Perovskia thrives in dry soil and requires little water once established. It tolerates a wide range of soil ph."|"Full sun"|"low"|"low"
Petunia|Petunia|"Annuals, Perennials"|"Petunias are available in almost all colors except for true blue. The most common colors are white, yellow, pink, red and purple."|":8:9:10:11:"|"Spring, Autumn, Summer"|"The species range in size from 15 cm to 120 cm (6 inches to 4 ft) in height."|"Petunia prefers fertile, moist, but well drained soil, with a pH between 6.0 and 7.0."|"Full sun, Partial sun"|"average"|"low"
Phacelia|Scorpionweed|"Annuals, Perennials"|"The flowers are most commonly seen in shades of purple and blue."|":2:3:4:5:6:7:8:9:10:"|"Spring, Summer"|"Phacelia can grow up to 120 cm (4 ft) high."|"Phacelia prefers well drained soils within a pH range of 6.5 to 8.5."|"Full sun, Partial sun"|"low"|"low"
Phlox|Phlox|"Annuals, Perennials"|"There are many different color varieties available, such as white, yellow, pink, purple, red, lavender, rose, magenta."|":2:3:4:5:6:7:8:9:"|"Spring, Autumn, Summer"|"Phlox can be found in different sizes, from dwarf species only around 10 cm (4 inches) in height to some reaching 120 cm (4 ft) tall."|"This plant prefers moist, but well drained soil, with a pH level between 5.0 and 6.5."|"Full sun, Partial sun"|"average"|"medium"
Platycodon|Balloon Flower; Chinese Bellflower; Japanese Bellflower|"Perennials"|"Platycodon come in purple, blue, pink and white."|":3:4:5:6:7:8:"|"Autumn, Summer"|"The plant can grow nearly 60 cm (2 feet) tall."|"Platycodon will grow in any good well-drained soil, but prefers sandy soil. It will do best in a slightly acidic soil."|"Full sun, Partial sun"|"average"|"low"
Plumbago|Plumbago|"Annuals, Climbers, Perennials, Shrubs"|"The flowers come in a variety of colors, but the most common are blue and white."|":8:9:10:11:"|"Spring, Autumn, Winter, Summer"|"The plants can reach up to 3 m (10 ft) in height, although they are typically smaller."|"These plants prefer fertile and well-drained soils. They are drought tolerant and are not fussy about the soil&#39;s pH level."|"Full sun, Partial sun"|"average"|"low"
Plumeria|Frangipani; Hawaiian Lei Flower|"Shrubs, Trees"|"These flowers can be found in shades of white, yellow, pink and red."|":9:10:11:"|"Spring, Autumn, Summer"|"Their sizes vary depending on the variety. Some species can grow up to 10 metres (32 ft) in height, but dwarf varieties are also available."|"Plumeria prefers moist, but well drained soil that is slightly acidic."|"Full sun, Partial sun"|"average"|"low"
Polygonatum|Solomon&#39;s Seal|"Perennials"|"The flowers come in white, green or pink, in solid colors or in combinations."|":3:4:5:6:7:8:"|"Spring, Summer"|"These plants vary in height from 60 to 200 cm (2 to 7 ft), depending on species."|"This plant prefers fertile, moist and well-drained soil. It is not fussy about soil pH,"|"Partial sun, Shade"|"average"|"low"
Potentilla|Cinquefoil|"Annuals, Perennials, Shrubs"|"The flowers are usually yellow, but can also be white, purple, pink or red."|":2:3:4:5:6:7:8:9:"|"Spring, Autumn, Summer"|"Cinquefoil range in height from 30 to 120 cm (1 to 4 ft), depending on the varieties."|"It will thrive in almost any soil, though it prefers reasonably well-drained and moderately fertile soil. The soil pH should be between 5.0 and 7.0"|"Full sun, Partial sun"|"average"|"low"
Primula|Primrose|"Perennials"|"These flowers come in a wide range of colors, from blue, purple, green and orange to pink, red, yellow and white."|":3:4:5:6:7:8:9:"|"Spring"|"The species grows up to 60 cm (2 ft) in height."|"Primulas prefer moist, but well drained soil and grow best in neutral or slightly acidic soil."|"Full sun, Partial sun"|"average"|"low"
Protea|Protea|"Shrubs, Trees"|"These flowers come in shades of white, purple, red, orange, yellow and green."|":8:9:10:11:"|"Spring, Autumn, Winter, Summer"|"Proteas range in height from tiny shrubs to tall trees of 10 meters (33 ft)."|"The majority of species prefer well drained, sandy and slightly acidic soil (pH 5.5 to 7.0)."|"Full sun"|"low"|"low"
Prunus|Prunus|"Shrubs, Trees"|"Prunus flowers comes in shades of white, pink, purple and red."|":2:3:4:5:6:7:8:9:"|"Spring, Autumn, Winter, Summer"|"These plats range in height from 1,5 metres to 12 metres (5 to 40 ft) tall."|"Prunus likes moist and well drained soil that is acidic, neutral or alkaline."|"Full sun"|"average"|"low"
Pulmonaria|Lungwort|"Perennials"|"The flowers come in shades of blue, purple, pink and white."|":3:4:5:6:7:8:9:"|"Spring, Winter"|"Pulmonaria can grow up to 30 cm (1 ft) tall."|"Pulmonaria likes moist and well drained soil. Most of the species thrive best in soil with a pH in the 7.0 to 7.5 range."|"Partial sun, Shade"|"average"|"low"
Quesnelia|Quesnelia|"Cactus - Succulents, Perennials"|"The flowers come in red, blue, pink and yellow colors."|":9:10:11:12:"|"Spring, Winter"|"These plants can grow up to 60 cm (2 ft) in height."|"Quesnelia prefers moist and well drained soil. It is not fussy about soil pH."|"Full sun, Partial sun, Shade"|"average"|"low"
Rafflesia|Rafflesia|""|"Rafflesia is reddish brown with white marks on its petals."|"13"|"Spring, Autumn, Winter, Summer"|"Rafflesia can reach up to 1 m (more than 3 ft) in diameter."|"Rafflesia is a parasitic plant and depends completely upon its host, so it doesn&#39;t need any soil. Anyway, it has no roots, leaves or stem."|"Full sun, Partial sun, Shade"|"average"|"low"
Ranunculus|Buttercup; Crowfoot; Spearwort|"Annuals, Bulbs, Perennials"|"The flowers are usually yellow, but may also be white, pink and red."|":7:8:9:10:11:"|"Spring, Summer"|"Ranunculus can reach a height of between 20 and 60 cm (8 inches to 2 ft), depending on species."|"The plant prefers moist and well drained soil. The pH level of the soil should be slightly acidic."|"Full sun, Partial sun"|"average"|"low"
Rhododendron|Azalea|"Shrubs, Trees"|"Rhododendron blooms in various colors, from pure white to red, orange and pink to gold and purple."|":3:4:5:6:7:8:9:10:11:"|"Spring, Autumn, Winter, Summer"|"The species range in size from low ground covers and medium sized shrubs to trees that can reach 25 metres (82 ft) tall."|"Rhododendrons will perform best in moist and well drained soil, with a pH level between 4.5 and 6.0."|"Partial sun"|"average"|"low"
Rondeletia|Rondeletia|"Shrubs, Trees"|"The flowers are white, yellow, pink and red, sometimes with yellow centers."|":9:10:11:"|"Spring, Autumn, Winter, Summer"|"The plant can grow up to 4,5 metres (15 ft) tall."|"Rondeletia will grow best in rich, moist and well drained soil that is slightly acidic."|"Full sun, Partial sun"|"average"|"low"
Rosa|Rose|"Climbers, Roses, Shrubs"|"Roses range in color from white and yellow to red, pink and purple."|":2:3:4:5:6:7:8:9:10:"|"Spring, Autumn, Summer"|"Roses range in size from dwarf species to climbers that can reach 12 metres (40 ft) in height."|"This plant grows best in moist and well drained soil, with a pH level between 5.5 and 7.0."|"Full sun, Partial sun"|"average"|"medium"
Rudbeckia|Black-eyed Susan; Coneflower|"Annuals, Perennials"|"Rudbeckias are mostly yellow, but also can be red and orange, with central cones that can be green, black and brown."|":3:4:5:6:7:8:9:"|"Autumn, Summer"|"This plant grows between 30 and 120 cm (1 to 4 ft) in height."|"Rudbeckia likes moist and well drained soil that is neutral, alkaline or acidic."|"Full sun, Partial sun"|"average"|"low"
Russelia|Russelia|"Annuals, Perennials, Shrubs"|"These plants have attractively colored flowers in shades of red, pink and cream."|":9:10:11:"|"Spring, Autumn, Summer"|"These plants can grow up to 1.8 m (6 ft) in height."|"They prefer moist and well-drained soil, with a pH range between 6.0 and 8.0."|"Full sun, Partial sun"|"low"|"low"
Salvia|Sage|"Annuals, Perennials, Shrubs"|"Salvia blooms in a range of colors, from traditional dark blue to light blue, red, pink, and white."|":3:4:5:6:7:8:9:10:11:"|"Spring, Autumn, Winter, Summer"|"Salvia grows from 30 cm to 180 cm (1 to 6 ft) tall, depending on species."|"Salvia grows best in moist, but well-drained soil, with a pH level between 6.0 and 7.0."|"Full sun, Partial sun"|"average"|"low"
Sandersonia|Christmas Bells; Chinese Lantern Lily|"Climbers, Perennials"|"The flowers are orange or yellow."|":8:9:10:11:"|"Spring, Summer"|"This plant grows up to 90 cm (3 ft) in height."|"Sandersonia aurantiaca prefers sandy or loamy soil that is moist, well drained and slightly acidic."|"Full sun"|"average"|"low"
Saxifraga|Saxifrage; Rockfoil|"Perennials"|"The flowers are usually white, but may be yellow, purple, pink and red."|":3:4:5:6:7:8:9:10:"|"Spring, Autumn, Winter, Summer"|"This plant usually reaches about 30 cm (1 ft) in height."|"Appropriate soil type depends on species. In general, these plants like moist and well-drained soil, with a pH level between 6.0 and 8.0."|"Full sun, Partial sun, Shade"|"average"|"low"
Scabiosa|Scabious; Pincushion Flower|"Annuals, Perennials"|"These flowers come in different colors including blue, purple, white, yellow, pink and red."|":3:4:5:6:7:8:9:"|"Autumn, Summer"|"Scabiosa typically ranges in height from 15 cm (6 inches) to 60 cm (2 ft)."|"Scabiosa grows best in rich soil with good drainage and with plenty of sunlight. It can be grown in soils with a pH range from 5.0 to 7.5."|"Full sun"|"average"|"low"
Scilla|Squill|"Bulbs"|"Scilla comes in shades of blue, purple and white. The blue ones are very pretty, some of the best blues to be found among flowers."|":2:3:4:5:6:7:8:9:10:"|"Spring, Winter"|"Scilla can grow up to 60 cm (2 ft) high However, some species are less than 10 cm (4 inches) tall."|"Scilla likes rich and well drained soil, with a pH level between 6.0 and 8.0. It will not grow well in waterlogged soils."|"Full sun, Partial sun"|"average"|"low"
Sedum|Stonecrop|"Annuals, Cactus - Succulents, Perennials, Shrubs"|"The flowers come in a rainbow of colors, from red, orange, pink and purple to yellow and white. The foliage can be found in different colors, too."|":3:4:5:6:7:8:9:10:"|"Autumn, Summer"|"Sedums can grow from 10 to 90 cm (4 inches to 3 ft), depending on variety."|"These plants prefer well drained soil that is neutral, alkaline or acidic. The ideal soil pH is between 6.0 and 8.0."|"Full sun, Partial sun"|"low"|"low"
Solidago|Goldenrod|"Perennials"|"Goldenrods come in a bright, golden-yellow color."|":3:4:5:6:7:8:9:"|"Autumn, Summer"|"Goldenrods can grow up to 90 cm (3 ft) in height, while some species are only 10 cm (4 inches) tall."|"Solidago grows best in well drained soil that is acidic to neutral."|"Full sun"|"average"|"low"
Spiraea|Spirea|"Shrubs"|"The flowers come in shades of purple, pink, yellow, cream and white."|":3:4:5:6:7:8:9:"|"Spring, Autumn, Summer"|"These plants can grow up to 3 m (10 ft) in height, depending on species."|"The plant grows in almost any type of soil that is well-drained. The ideal soil pH is between 6.0 and 7.0. If soil is too alkaline (above 7.0), it may reduce the plant&#39;s ability to take up some nutrients resulting in the yellowing of foliage (chlorosis)."|"Full sun, Partial sun"|"average"|"low"
Strelitzia|Bird of Paradise; Crane Flower|"Perennials, Shrubs"|"The flowers are orange, red, yellow or even blue and purple."|":9:10:11:12:"|"Spring, Autumn, Winter, Summer"|"Strelitzia can grow as tall as 1 m (3 ft) or taller, while some species (Strelitzia nicolai) can reach 10 metres (33 ft) high."|"Strelitzia prefers organically rich, moist and well drained soil. The optimal soil pH is between 6.0 and 6.5. If treated well, this plant can produce up to 36 flower spikes a year."|"Full sun, Partial sun"|"average"|"low"
Syringa|Lilac|"Shrubs, Trees"|"Although they get their common name from their most popular color, Lilacs can also be found in other colors such as blue, red, pink, white and yellow."|":3:4:5:6:7:8:"|"Spring, Summer"|"Lilacs range in size from 2 to 10 metres (7 to 33 ft) high, depending on species."|"These plants prefer fertile, moist, but well-drained soil. The ideal soil pH for growing Lilacs is neutral to alkaline."|"Full sun, Partial sun"|"average"|"low"
